{
  "stage": "PREPARE_INSTALL_VERIFICATION",
  "status": "skipped",
  "reason": "review_not_approved_yet",
  "run_id": "sandbox-2026-04-19-154400-dnnpkaefmlha-v0-1-1-6218cc",
  "item_id": "dnnpkaefmlhacigijccbhemgaenjbcpk",
  "publisher_id": "7462c8f7-9c1a-48ed-9249-894c0317bd46",
  "expected_version": "0.1.1",
  "expected_crx_version": "0.1.1",
  "trusted_tester_required": true,
  "install_url": "https://chromewebstore.google.com/detail/dnnpkaefmlhacigijccbhemgaenjbcpk",
  "verification_steps": [
    "Use a trusted tester account to install the sandbox extension from the Chrome Web Store.",
    "Confirm the installed version is 0.1.1.",
    "Open the controlled form fixture used for the sandbox validation scenario.",
    "Click the extension action to trigger the saved profile fill flow.",
    "Verify that 5 expected fields are populated with the stored profile values.",
    "Capture a screenshot showing the populated fields and extension state.",
    "Write state/run_events/<run_id>/93_manual_install_verification.json with the tester result."
  ],
  "expected_happy_path": [
    "LeadFill One Profile installs for the trusted tester without warnings.",
    "The popup opens and the saved profile is available for the fill action.",
    "The controlled form fixture is filled correctly and visibly."
  ],
  "screenshots_required": true,
  "result_artifact_path": "state/run_events/sandbox-2026-04-19-154400-dnnpkaefmlha-v0-1-1-6218cc/93_manual_install_verification.json",
  "blockers": [
    "review_not_approved_yet"
  ],
  "next_step": "wait_for_review_or_manual_cancel",
  "redaction_checks": {
    "sanitized_response_bodies": true,
    "checked_secret_value_count": 0,
    "secret_values_present_in_artifact": false,
    "authorization_header_pattern_present": false,
    "key_material_pattern_present": false,
    "secret_marker_pattern_present": false,
    "redaction_guard_triggered": false
  }
}
